{
    "schemaVersion": "1.0",
    "created": "2014-11-19T17:50:38Z",
    "module": "IRIS WEB SERVICE: fdsnws-station | version: 1.0.0-TEST",
    "moduleURI": "http://service.iris.edu/fdsnws/station/1/query?net=IU&level=network&format=json",
    "sender": "IRIS-DMC",
    "source": "IRIS-DMC",
    "networks": [
        {
            "code": "IU",
            "startTime": "2000-01-01T11:30:22Z",
            "endTime": null,
            "description": "Global Seismograph Network (GSN - IRIS/USGS)",
            "restrictedStatus": "open",
            "totalNumberStations": 92,
            "selectedNumberStations": 92
        }
    ]
}
